{
  "goal": "ダッシュボードにグラフ表示とフィルター機能を追加する",
  "subtasks": [
    {
      "id": "1",
      "title": "ダッシュボードレイアウト作成",
      "dod": "主要指標カードとグラフ領域がレスポンシブに表示される"
    },
    {
      "id": "2",
      "title": "時系列グラフコンポーネント実装",
      "dod": "選択した指標の折れ線グラフが描画される"
    },
    {
      "id": "3",
      "title": "フィルター UI 実装",
      "dod": "日付範囲とカテゴリでデータを絞り込める"
    },
    {
      "id": "4",
      "title": "データ取得 API 連携",
      "dod": "フィルター条件に応じた集計データが取得される"
    },
    {
      "id": "5",
      "title": "空状態とローディング表示",
      "dod": "データ未取得時と読込中の UX が定義どおり表示される"
    },
    {
      "id": "6",
      "title": "ダッシュボード画面テスト",
      "dod": "フィルター変更でグラフが更新されることがテストされる"
    }
  ],
  "scope_files": [
    "src/pages/dashboard.tsx",
    "src/components/charts/",
    "src/components/filters/"
  ],
  "risk_notes": [
    "大量データ時のクエリ性能に注意",
    "グラフライブラリのバンドルサイズ増加を確認する"
  ],
  "confidence": "medium"
}
