{
  "goal": "ログイン画面と認証機能を実装する",
  "subtasks": [
    {
      "id": "1",
      "title": "ログイン UI コンポーネント作成",
      "dod": "メール/パスワード入力フォームと送信ボタンが表示される"
    },
    {
      "id": "2",
      "title": "認証 API エンドポイント実装",
      "dod": "POST /auth/login が有効な資格情報で JWT を返す"
    },
    {
      "id": "3",
      "title": "セッション管理と保護ルート",
      "dod": "未認証ユーザーが保護ページにアクセスできない"
    },
    {
      "id": "4",
      "title": "認証フローのテスト追加",
      "dod": "ログイン成功/失敗ケースが自動テストでカバーされる"
    }
  ],
  "scope_files": [
    "src/pages/login.tsx",
    "src/auth/",
    "tests/auth/"
  ],
  "risk_notes": [
    "既存ユーザーデータベーススキーマとの整合性を確認する",
    "パスワードハッシュ方式はプロジェクト標準に合わせる"
  ],
  "confidence": "medium"
}
